{
  "schema_id": "ion.joc_cockpit_component_contract.v1",
  "version": "V56_ION_JOC_COCKPIT_SHELL_COMPONENT_CONTRACTS",
  "component_set_name": "ION/JOC V56 Cockpit Shell Scaffold",
  "target_ui": "ION/JOC maintained work surface cockpit",
  "source_projection_receipt_ids": ["v55-ui-work-surface-projection-reference"],
  "layout_zones": ["TOP_BAR", "LEFT_RAIL", "MAIN_WORK_SURFACE", "RIGHT_INSPECTOR", "BOTTOM_TIMELINE"],
  "projection_surfaces": [
    "MAINTAINED_WORK_SURFACE_OVERVIEW",
    "FRONT_STAGE_COUNCIL_STATE_STRIP",
    "CLAIM_AND_RECEIPT_RAIL",
    "VISUAL_EVIDENCE_LENS",
    "MISSION_DISPATCH_AND_MODEL_ROUTE_PANEL",
    "CONTEXT_GRAPH_COGNITIVE_EXPLORER",
    "REACTIVE_OS_STREAM",
    "CONVERSATIONAL_REPAIR_QUEUE",
    "BROWSER_SESSION_AUTOMATION_OVERLAY",
    "COMPUTE_AND_COST_ROUTER"
  ],
  "automation_loops": [
    "VISUAL_ISSUE_CLOSURE_LOOP",
    "MISSION_DISPATCH_LOOP",
    "SESSION_HEALTH_LOOP",
    "CONTEXT_PROJECTION_LOOP",
    "CONVERSATIONAL_REPAIR_LOOP",
    "MODEL_COST_QUALITY_LOOP"
  ],
  "dxl_constraints": {
    "no_emoji_ui_controls": true,
    "custom_inline_svg_icons": true,
    "mono_dense_uppercase_labels": true,
    "instrument_panel_radius_lte_2px": true,
    "no_material_design_structural_colors": true,
    "no_placeholder_only_finished_panels": true,
    "desktop_first_full_width_layout": true
  },
  "forbidden_capabilities": {
    "production_authority": false,
    "unrestricted_browser_control": false,
    "credential_access": false,
    "external_network_authority": false,
    "account_operation": false,
    "destructive_action": false,
    "form_submission": false,
    "purchase_or_submission": false,
    "persistent_dom_mutation": false,
    "production_visual_automation": false
  },
  "components": [
    {
      "name": "IonTopBar",
      "layout_zone": "TOP_BAR",
      "projection_surfaces": ["FRONT_STAGE_COUNCIL_STATE_STRIP"],
      "automation_loops": ["MODEL_COST_QUALITY_LOOP"],
      "claim_lanes": ["C0", "C1", "C2", "C3", "C4", "C5"],
      "evidence_lanes": ["STEWARD_STATE", "ORACLE_MODE"],
      "receipts_rendered": ["front_stage_council_runtime_receipt"]
    },
    {
      "name": "IonLeftRail",
      "layout_zone": "LEFT_RAIL",
      "projection_surfaces": ["MAINTAINED_WORK_SURFACE_OVERVIEW", "CONTEXT_GRAPH_COGNITIVE_EXPLORER"],
      "automation_loops": ["CONTEXT_PROJECTION_LOOP"],
      "claim_lanes": ["C0", "C1", "C2"],
      "evidence_lanes": ["ACTIVE_REGION", "WORK_SURFACE_MODE"]
    },
    {
      "name": "IonMainWorkSurface",
      "layout_zone": "MAIN_WORK_SURFACE",
      "projection_surfaces": ["MAINTAINED_WORK_SURFACE_OVERVIEW", "VISUAL_EVIDENCE_LENS", "MISSION_DISPATCH_AND_MODEL_ROUTE_PANEL", "BROWSER_SESSION_AUTOMATION_OVERLAY"],
      "automation_loops": ["VISUAL_ISSUE_CLOSURE_LOOP", "MISSION_DISPATCH_LOOP", "SESSION_HEALTH_LOOP"],
      "claim_lanes": ["C0", "C1", "C2", "C3"],
      "evidence_lanes": ["VISUAL_OBSERVATION", "DIAGNOSIS", "BEFORE_AFTER", "LOCAL_RUN"]
    },
    {
      "name": "IonRightInspector",
      "layout_zone": "RIGHT_INSPECTOR",
      "projection_surfaces": ["CLAIM_AND_RECEIPT_RAIL", "VISUAL_EVIDENCE_LENS", "COMPUTE_AND_COST_ROUTER"],
      "automation_loops": ["VISUAL_ISSUE_CLOSURE_LOOP", "MODEL_COST_QUALITY_LOOP"],
      "claim_lanes": ["C0", "C1", "C2", "C3", "C4", "C5"],
      "evidence_lanes": ["RECEIPTS", "EVIDENCE_REFS", "NON_AUTHORITY_BOUNDARIES"],
      "receipts_rendered": ["visual_run_to_diagnosis_binding_receipt", "ui_work_surface_projection_receipt"]
    },
    {
      "name": "IonBottomTimeline",
      "layout_zone": "BOTTOM_TIMELINE",
      "projection_surfaces": ["REACTIVE_OS_STREAM", "CONVERSATIONAL_REPAIR_QUEUE"],
      "automation_loops": ["CONVERSATIONAL_REPAIR_LOOP", "CONTEXT_PROJECTION_LOOP", "SESSION_HEALTH_LOOP"],
      "claim_lanes": ["C1", "C2", "C3", "C4"],
      "evidence_lanes": ["EVENTS", "REPAIRS", "RUN_OUTPUT"]
    },
    {
      "name": "ReceiptRail",
      "layout_zone": "RIGHT_INSPECTOR",
      "projection_surfaces": ["CLAIM_AND_RECEIPT_RAIL"],
      "automation_loops": ["VISUAL_ISSUE_CLOSURE_LOOP", "CONVERSATIONAL_REPAIR_LOOP"],
      "claim_lanes": ["C0", "C1", "C2", "C3", "C4", "C5"],
      "evidence_lanes": ["RECEIPT_LIST", "AUTHORITY_SCOPE", "REPAIR_OBLIGATIONS"]
    },
    {
      "name": "VisualEvidenceLens",
      "layout_zone": "MAIN_WORK_SURFACE",
      "projection_surfaces": ["VISUAL_EVIDENCE_LENS"],
      "automation_loops": ["VISUAL_ISSUE_CLOSURE_LOOP"],
      "claim_lanes": ["C0", "C1", "C2"],
      "evidence_lanes": ["OBSERVATION", "DIAGNOSIS", "BEFORE_AFTER", "LOCAL_RUN", "CLOSURE"]
    },
    {
      "name": "ReactiveOsStream",
      "layout_zone": "BOTTOM_TIMELINE",
      "projection_surfaces": ["REACTIVE_OS_STREAM"],
      "automation_loops": ["CONTEXT_PROJECTION_LOOP", "SESSION_HEALTH_LOOP", "MISSION_DISPATCH_LOOP"],
      "claim_lanes": ["C1", "C2", "C3"],
      "evidence_lanes": ["FILESYSTEM_EVENT", "GRAPH_REFRESH", "TEST_RUN", "DISPATCH_EVENT"]
    },
    {
      "name": "MissionRoutePanel",
      "layout_zone": "MAIN_WORK_SURFACE",
      "projection_surfaces": ["MISSION_DISPATCH_AND_MODEL_ROUTE_PANEL"],
      "automation_loops": ["MISSION_DISPATCH_LOOP", "MODEL_COST_QUALITY_LOOP"],
      "claim_lanes": ["C1", "C2", "C3"],
      "evidence_lanes": ["ROUTING_REASON", "COST_ESTIMATE", "LATENCY_ESTIMATE", "MODEL_CAPABILITY"]
    },
    {
      "name": "ContextGraphExplorer",
      "layout_zone": "MAIN_WORK_SURFACE",
      "projection_surfaces": ["CONTEXT_GRAPH_COGNITIVE_EXPLORER"],
      "automation_loops": ["CONTEXT_PROJECTION_LOOP"],
      "claim_lanes": ["C0", "C1", "C2"],
      "evidence_lanes": ["GRAPH_NODE", "GRAPH_EDGE", "SOURCE_PATH", "SELECTED_CONTEXT"]
    },
    {
      "name": "ConversationalRepairQueue",
      "layout_zone": "BOTTOM_TIMELINE",
      "projection_surfaces": ["CONVERSATIONAL_REPAIR_QUEUE"],
      "automation_loops": ["CONVERSATIONAL_REPAIR_LOOP"],
      "claim_lanes": ["C1", "C2", "C3", "C4"],
      "evidence_lanes": ["USER_CORRECTION", "CLAIM_MOVEMENT", "ARTIFACT_REPAIR_OBLIGATION"]
    },
    {
      "name": "BrowserAutomationOverlay",
      "layout_zone": "MAIN_WORK_SURFACE",
      "projection_surfaces": ["BROWSER_SESSION_AUTOMATION_OVERLAY"],
      "automation_loops": ["SESSION_HEALTH_LOOP", "VISUAL_ISSUE_CLOSURE_LOOP"],
      "claim_lanes": ["C0", "C1", "C2"],
      "evidence_lanes": ["DOM_TARGET", "INJECTION_ZONE", "EXTRACTION_ZONE", "SESSION_HEALTH"]
    },
    {
      "name": "ComputeCostRouter",
      "layout_zone": "RIGHT_INSPECTOR",
      "projection_surfaces": ["COMPUTE_AND_COST_ROUTER"],
      "automation_loops": ["MODEL_COST_QUALITY_LOOP", "MISSION_DISPATCH_LOOP"],
      "claim_lanes": ["C1", "C2", "C3"],
      "evidence_lanes": ["COMPUTE_RING", "BUDGET", "QUALITY_MARGIN", "FALLBACK"]
    }
  ],
  "notes": ["Static component contract fixture for V56 validation; not live UI evidence."]
}
